id,conversation_id,created_at,date,time,timezone,user_id,username,name,place,tweet,mentions,urls,photos,replies_count,retweets_count,likes_count,hashtags,cashtags,link,retweet,quote_url,video,near,geo,source,user_rt_id,user_rt,retweet_id,reply_to,retweet_date,translate,trans_src,trans_dest
1239954585915133961,1239954585915133961,1584463185000,2020-03-17,12:39:45,EDT,1064603540956565504,govtimwalz,Governor Tim Walz,,Thanks to my sister in law Maribeth Sagmoe who sent bars for my team! She then went to prepare to serve her students as a teacher in the Richfield Schools. That’s what Minnesotans do! pic.twitter.com/4ExBVy4StU,[],[],['https://pbs.twimg.com/media/ETU0G-5WsAY29DV.jpg'],17,19,541,[],[],https://twitter.com/GovTimWalz/status/1239954585915133961,False,,0,,,,,,,"[{'user_id': '1064603540956565504', 'username': 'GovTimWalz'}]",,,,
1239680871101337605,1239680871101337605,1584397926000,2020-03-16,18:32:06,EDT,1064603540956565504,govtimwalz,Governor Tim Walz,,"Now is the time to take decisive action to curb the spread of #COVIDー19. That’s why I’m ordering a partial closure of bars, restaurants & other places of public amusement or accommodation beginning tomorrow at 5 p.m.

🎥: https://www.facebook.com/GovTimWalz/videos/503729257180741/?sfnsn=mo&d=n&vh=e …",[],['https://www.facebook.com/GovTimWalz/videos/503729257180741/?sfnsn=mo&d=n&vh=e'],[],241,401,1312,['#covidー19'],[],https://twitter.com/GovTimWalz/status/1239680871101337605,False,,0,,,,,,,"[{'user_id': '1064603540956565504', 'username': 'GovTimWalz'}]",,,,
1239334820070776833,1239334817684246529,1584315421000,2020-03-15,19:37:01,EDT,1064603540956565504,govtimwalz,Governor Tim Walz,,Let’s work together to keep all Minnesotans safe and healthy. Families with questions about #COVID-19 may call 1-800-657-3903 and child care providers with questions may call 1-888-234-1268.,[],[],[],18,34,70,['#covid'],[],https://twitter.com/GovTimWalz/status/1239334820070776833,False,,0,,,,,,,"[{'user_id': '1064603540956565504', 'username': 'GovTimWalz'}]",,,,
1239334818820874240,1239334817684246529,1584315421000,2020-03-15,19:37:01,EDT,1064603540956565504,govtimwalz,Governor Tim Walz,,"During the coming weeks, as we respond to #COVIDー19, families will rely heavily on child care providers. As the child care providers respond to health guidance and changing circumstances, they will need support and flexibility from families too. https://content.govdelivery.com/accounts/MNDHS/bulletins/2814f60 …",[],['https://content.govdelivery.com/accounts/MNDHS/bulletins/2814f60'],[],6,16,60,['#covidー19'],[],https://twitter.com/GovTimWalz/status/1239334818820874240,False,,0,,,,,,,"[{'user_id': '1064603540956565504', 'username': 'GovTimWalz'}]",,,,
1239334817684246529,1239334817684246529,1584315420000,2020-03-15,19:37:00,EDT,1064603540956565504,govtimwalz,Governor Tim Walz,,@LtGovFlanagan and I are grateful for child care providers who support MN families. Today we encouraged child care providers to remain open at this time and issued guidance to protect their health and safety. Child care providers with questions may call 1-888-234-1268.,['ltgovflanagan'],[],[],35,36,117,[],[],https://twitter.com/GovTimWalz/status/1239334817684246529,False,,0,,,,,,,"[{'user_id': '1064603540956565504', 'username': 'GovTimWalz'}, {'user_id': '1064636307257860096', 'username': 'LtGovFlanagan'}]",,,,
1239277515031674880,1239277515031674880,1584301758000,2020-03-15,15:49:18,EDT,1064603540956565504,govtimwalz,Governor Tim Walz,,I'm there. https://twitter.com/janashortal/status/1238914953484144640 …,[],['https://twitter.com/janashortal/status/1238914953484144640'],[],47,60,1586,[],[],https://twitter.com/GovTimWalz/status/1239277515031674880,False,https://twitter.com/janashortal/status/1238914953484144640,0,,,,,,,"[{'user_id': '1064603540956565504', 'username': 'GovTimWalz'}]",,,,
1239205173664284674,1239205173664284674,1584284511000,2020-03-15,11:01:51,EDT,1064603540956565504,govtimwalz,Governor Tim Walz,,"My top priority as Governor is the safety of Minnesotans, especially our kids. That’s why I’m ordering the temporary closure of schools so we can put plans in place to educate and feed our students, regardless of what's to come.

🎥: https://www.facebook.com/GovTimWalz/videos/3102820903084016/?sfnsn=mo&d=n&vh=e …",[],['https://www.facebook.com/GovTimWalz/videos/3102820903084016/?sfnsn=mo&d=n&vh=e'],[],315,526,2017,[],[],https://twitter.com/GovTimWalz/status/1239205173664284674,False,,0,,,,,,,"[{'user_id': '1064603540956565504', 'username': 'GovTimWalz'}]",,,,
1238528352895545345,1238528352895545345,1584123144000,2020-03-13,14:12:24,EDT,1064603540956565504,govtimwalz,Governor Tim Walz,,"The safety of Minnesotans is my top priority which is why I’m declaring a peacetime state of emergency. I advise and urge Minnesotans to follow @mnhealth community mitigation strategies to combat the spread of #COVIDー19.

🎥: https://www.facebook.com/GovTimWalz/videos/551822198791043/?sfnsn=mo&d=n&vh=e …",['mnhealth'],['https://www.facebook.com/GovTimWalz/videos/551822198791043/?sfnsn=mo&d=n&vh=e'],[],395,210,639,['#covidー19'],[],https://twitter.com/GovTimWalz/status/1238528352895545345,False,,0,,,,,,,"[{'user_id': '1064603540956565504', 'username': 'GovTimWalz'}, {'user_id': '25149628', 'username': 'mnhealth'}]",,,,
1238118653276626944,1238118653276626944,1584025464000,2020-03-12,11:04:24,EDT,1064603540956565504,govtimwalz,Governor Tim Walz,,"Minnesotans know the importance of having a plan and being prepared for whatever comes our way. That's why @LtGovFlanagan and I are focusing our supplemental budget proposal on emergency response and preparedness.

🎥: https://www.facebook.com/GovTimWalz/videos/2839833852798048/?sfnsn=mo&d=n&vh=e …",['ltgovflanagan'],['https://www.facebook.com/GovTimWalz/videos/2839833852798048/?sfnsn=mo&d=n&vh=e'],[],74,37,166,[],[],https://twitter.com/GovTimWalz/status/1238118653276626944,False,,0,,,,,,,"[{'user_id': '1064603540956565504', 'username': 'GovTimWalz'}, {'user_id': '1064636307257860096', 'username': 'LtGovFlanagan'}]",,,,
1237908439596249088,1237908439596249088,1583975345000,2020-03-11,21:09:05,EDT,1064603540956565504,govtimwalz,Governor Tim Walz,,"This afternoon I spoke with @SPPS_News Superintendent @JoeGothard and @SPFE28 President @nfabe and strongly encouraged both of them to head back to the table, negotiate in good faith, and come to an agreement that’s good for our students, our schools, and our educators.","['spps_news', 'joegothard', 'spfe28', 'nfabe']",[],[],27,43,291,[],[],https://twitter.com/GovTimWalz/status/1237908439596249088,False,,0,,,,,,,"[{'user_id': '1064603540956565504', 'username': 'GovTimWalz'}, {'user_id': '726033618', 'username': 'SPPS_News'}, {'user_id': '77084909', 'username': 'JoeGothard'}, {'user_id': '2350510153', 'username': 'SPFE28'}, {'user_id': '56448196', 'username': 'nfabe'}]",,,,
1237507341001555971,1237507341001555971,1583879716000,2020-03-10,18:35:16,EDT,1064603540956565504,govtimwalz,Governor Tim Walz,,"Thank you to the disability community for letting your voices be heard today at the Capitol! Direct support professionals are critical to supporting Minnesotans with disabilities as they live full, meaningful lives, and we’re committed to supporting them in that work #SeeOurDSPs pic.twitter.com/h3rNLCXCgt",[],[],['https://pbs.twimg.com/media/ESyCXRJUUAAC88-.jpg'],4,17,142,['#seeourdsps'],[],https://twitter.com/GovTimWalz/status/1237507341001555971,False,,0,,,,,,,"[{'user_id': '1064603540956565504', 'username': 'GovTimWalz'}]",,,,
1237420435433816065,1237420434523590658,1583858996000,2020-03-10,12:49:56,EDT,1064603540956565504,govtimwalz,Governor Tim Walz,,🎥: https://www.facebook.com/GovTimWalz/videos/635176433970389/?sfnsn=mo&d=n&vh=e …,[],['https://www.facebook.com/GovTimWalz/videos/635176433970389/?sfnsn=mo&d=n&vh=e'],[],1,3,21,[],[],https://twitter.com/GovTimWalz/status/1237420435433816065,False,,0,,,,,,,"[{'user_id': '1064603540956565504', 'username': 'GovTimWalz'}]",,,,
1237420434523590658,1237420434523590658,1583858996000,2020-03-10,12:49:56,EDT,1064603540956565504,govtimwalz,Governor Tim Walz,,Preparing our state for #COVIDー19 has become our top priority. This pressing public health crisis transcends partisanship. That's why I'm proud to sign this bipartisan legislation into law to prepare for a potential outbreak and protect the health of Minnesotans.,[],[],[],64,58,443,['#covidー19'],[],https://twitter.com/GovTimWalz/status/1237420434523590658,False,,0,,,,,,,"[{'user_id': '1064603540956565504', 'username': 'GovTimWalz'}]",,,,
1237156059426574339,1237156059426574339,1583795964000,2020-03-09,19:19:24,EDT,1064603540956565504,govtimwalz,Governor Tim Walz,,"My message at Minnesotanos Day at the Capitol this morning: we value and stand with our Latino community. From boosting our economy as small business owners and employees to contributing to the culture of our great state, we are stronger because you are here. pic.twitter.com/6Pjqh249lV",[],[],['https://pbs.twimg.com/media/EStCxoWXkAIeeLU.jpg'],9,8,57,[],[],https://twitter.com/GovTimWalz/status/1237156059426574339,False,,0,,,,,,,"[{'user_id': '1064603540956565504', 'username': 'GovTimWalz'}]",,,,
1237078218508840962,1237078218508840962,1583777405000,2020-03-09,14:10:05,EDT,1064603540956565504,govtimwalz,Governor Tim Walz,,"Last Friday, I spent the morning celebrating National Reading Month with Minnesota’s littlest learners. This month pick up a book and read with children in your life. #NationalReadingMonth #MarchIsReadingMonth pic.twitter.com/XSDWJ9hzTn",[],[],"['https://pbs.twimg.com/media/ESr6U7LWkAAfWWo.jpg', 'https://pbs.twimg.com/media/ESr6U8QXQAIgFrO.jpg']",4,6,107,"['#nationalreadingmonth', '#marchisreadingmonth']",[],https://twitter.com/GovTimWalz/status/1237078218508840962,False,,0,,,,,,,"[{'user_id': '1064603540956565504', 'username': 'GovTimWalz'}]",,,,
1236727970951311366,1236727968917082112,1583693900000,2020-03-08,14:58:20,EDT,1064603540956565504,govtimwalz,Governor Tim Walz,,Thank you to my partner-in-justice @LtGovFlanagan and all women who have been leading the way to better representation and better results for all Minnesotans. #IWD2020,['ltgovflanagan'],[],[],1,2,26,['#iwd2020'],[],https://twitter.com/GovTimWalz/status/1236727970951311366,False,,0,,,,,,,"[{'user_id': '1064603540956565504', 'username': 'GovTimWalz'}, {'user_id': '1064636307257860096', 'username': 'LtGovFlanagan'}]",,,,
1236727968917082112,1236727968917082112,1583693899000,2020-03-08,14:58:19,EDT,1064603540956565504,govtimwalz,Governor Tim Walz,,"I'm proud to proclaim today #InternationalWomensDay. An equal world is a stronger world, because democracy works best when it reflects the communities we seek to represent. #IWD2020 https://twitter.com/LtGovFlanagan/status/1236701624636186624 …",[],['https://twitter.com/LtGovFlanagan/status/1236701624636186624'],[],3,9,80,"['#internationalwomensday', '#iwd2020']",[],https://twitter.com/GovTimWalz/status/1236727968917082112,False,https://twitter.com/LtGovFlanagan/status/1236701624636186624,0,,,,,,,"[{'user_id': '1064603540956565504', 'username': 'GovTimWalz'}]",,,,
1236071910259281922,1236071910259281922,1583537483000,2020-03-06,18:31:23,EDT,1064603540956565504,govtimwalz,Governor Tim Walz,,"Today, I announced the first #COVIDー19 case detected in Minnesota. This may be concerning, but the State of Minnesota is prepared. Learn more and stay up-to-date via @mnhealth:  https://www.health.state.mn.us/diseases/coronavirus/index.html …",['mnhealth'],['https://www.health.state.mn.us/diseases/coronavirus/index.html'],[],14,49,114,['#covidー19'],[],https://twitter.com/GovTimWalz/status/1236071910259281922,False,,0,,,,,,,"[{'user_id': '1064603540956565504', 'username': 'GovTimWalz'}, {'user_id': '25149628', 'username': 'mnhealth'}]",,,,
1236050034191450112,1236050031280562178,1583532267000,2020-03-06,17:04:27,EDT,1064603540956565504,govtimwalz,Governor Tim Walz,,We are collaborating across state agencies and remain in close contact with both federal and local partners as we monitor developments with this outbreak. Our state is fortunate to have a strong public health sector and world-class health care providers to keep Minnesotans safe.,[],[],[],9,26,69,[],[],https://twitter.com/GovTimWalz/status/1236050034191450112,False,,0,,,,,,,"[{'user_id': '1064603540956565504', 'username': 'GovTimWalz'}]",,,,
1236050031280562178,1236050031280562178,1583532266000,2020-03-06,17:04:26,EDT,1064603540956565504,govtimwalz,Governor Tim Walz,,"The State of Minnesota has been working around the clock to prepare for #COVIDー19 and I am confident that @mnhealth is up to the challenge.

🎥 https://www.facebook.com/GovTimWalz/videos/2534583853336071/?vh=e&d=n …",['mnhealth'],['https://www.facebook.com/GovTimWalz/videos/2534583853336071/?vh=e&d=n'],[],10,36,100,['#covidー19'],[],https://twitter.com/GovTimWalz/status/1236050031280562178,False,,0,,,,,,,"[{'user_id': '1064603540956565504', 'username': 'GovTimWalz'}, {'user_id': '25149628', 'username': 'mnhealth'}]",,,,
1235712989082333185,1235712989082333185,1583451909000,2020-03-05,18:45:09,EDT,1064603540956565504,govtimwalz,Governor Tim Walz,,"I welcomed @VP Pence to Minnesota today for a conversation at @3M about how we can partner across state and federal government, as well as the public and private sectors, to keep Minnesotans healthy #COVIDー19 pic.twitter.com/fDRbfMduYh","['vp', '3m']",[],['https://pbs.twimg.com/media/ESYiZ8eWAAEtCW7.jpg'],11,17,122,['#covidー19'],[],https://twitter.com/GovTimWalz/status/1235712989082333185,False,,0,,,,,,,"[{'user_id': '1064603540956565504', 'username': 'GovTimWalz'}, {'user_id': '818910970567344128', 'username': 'VP'}, {'user_id': '378197959', 'username': '3M'}]",,,,
1235205245590003712,1235205245590003712,1583330854000,2020-03-04,09:07:34,EDT,1064603540956565504,govtimwalz,Governor Tim Walz,,"Sitting down with our interns is always a highlight of my day. I love hearing their stories and passion for serving our state.

We're always looking for hardworking and passionate students to come work with us, so I encourage you to learn more and apply.
 https://mn.gov/governor/contact/internships.jsp … pic.twitter.com/VrTiExB7tf",[],['https://mn.gov/governor/contact/internships.jsp'],['https://pbs.twimg.com/media/ESRUYeVWAAAz2i4.jpg'],4,17,70,[],[],https://twitter.com/GovTimWalz/status/1235205245590003712,False,,0,,,,,,,"[{'user_id': '1064603540956565504', 'username': 'GovTimWalz'}]",,,,
1234895865803952134,1234895865803952134,1583257092000,2020-03-03,12:38:12,EDT,1064603540956565504,govtimwalz,Governor Tim Walz,,"Hey MN, today is our state’s presidential primary! I encourage everyone to get out and vote today — and you can even register at the polls.

Learn more and find your polling place here 🗳⬇️
 https://gttp.votinginfoproject.org/  pic.twitter.com/pg6DvoXOGz",[],['https://gttp.votinginfoproject.org/'],['https://pbs.twimg.com/media/ESM7PcCW4AAHO8S.jpg'],21,37,240,[],[],https://twitter.com/GovTimWalz/status/1234895865803952134,False,,0,,,,,,,"[{'user_id': '1064603540956565504', 'username': 'GovTimWalz'}]",,,,
1234520034569003008,1234520032916492288,1583167487000,2020-03-02,11:44:47,EDT,1064603540956565504,govtimwalz,Governor Tim Walz,,"The best available guidance for avoiding #COVID19 is to take the same precautions you take for avoiding colds and flu:
— Wash your hands thoroughly.
— Cover your cough.
— Stay home when sick.

Visit our @mnhealth website for more info:  https://www.health.state.mn.us/diseases/coronavirus/index.html …",['mnhealth'],['https://www.health.state.mn.us/diseases/coronavirus/index.html'],[],11,45,85,['#covid19'],[],https://twitter.com/GovTimWalz/status/1234520034569003008,False,,0,,,,,,,"[{'user_id': '1064603540956565504', 'username': 'GovTimWalz'}, {'user_id': '25149628', 'username': 'mnhealth'}]",,,,
1234520033772089344,1234520032916492288,1583167486000,2020-03-02,11:44:46,EDT,1064603540956565504,govtimwalz,Governor Tim Walz,,"MN is fortunate to have a strong disease surveillance system in place, and we are prepared to find cases quickly and respond to them effectively. #COVID19",[],[],[],4,10,65,['#covid19'],[],https://twitter.com/GovTimWalz/status/1234520033772089344,False,,0,,,,,,,"[{'user_id': '1064603540956565504', 'username': 'GovTimWalz'}]",,,,
1234520032916492288,1234520032916492288,1583167486000,2020-03-02,11:44:46,EDT,1064603540956565504,govtimwalz,Governor Tim Walz,,"The State of Minnesota is taking coronavirus seriously, and I receive daily briefings to monitor developments with this outbreak. While we are thankful that Minnesota has not had a case of novel coronavirus to this point, we are preparing for that possibility. #COVID19",[],[],[],17,59,373,['#covid19'],[],https://twitter.com/GovTimWalz/status/1234520032916492288,False,,0,,,,,,,"[{'user_id': '1064603540956565504', 'username': 'GovTimWalz'}]",,,,
1233510870929616897,1233510870929616897,1582926883000,2020-02-28,16:54:43,EDT,1064603540956565504,govtimwalz,Governor Tim Walz,,"As someone who has driven countless miles on Highway 14 and who has lost a dear neighbor on this road, this issue is personal to me and it’s personal to everyone in Southern Minnesota. Today I was proud to announce a funding plan to complete the final expansion of #HWY14. pic.twitter.com/8LyZa4nI07",[],[],['https://pbs.twimg.com/media/ER5PkgOXUAsxpwN.jpg'],4,7,93,['#hwy14'],[],https://twitter.com/GovTimWalz/status/1233510870929616897,False,,0,,,,,,,"[{'user_id': '1064603540956565504', 'username': 'GovTimWalz'}]",,,,
1233487204959346688,1233487204959346688,1582921241000,2020-02-28,15:20:41,EDT,1064603540956565504,govtimwalz,Governor Tim Walz,,Couldn’t make a trip to Mankato without stopping at @tandembagels for lunch! 🥯 pic.twitter.com/7lc7luQTLZ,['tandembagels'],[],['https://pbs.twimg.com/media/ER46EchXYAYj5PO.jpg'],5,4,89,[],[],https://twitter.com/GovTimWalz/status/1233487204959346688,False,,0,,,,,,,"[{'user_id': '1064603540956565504', 'username': 'GovTimWalz'}, {'user_id': '457054518', 'username': 'tandembagels'}]",,,,
1233262425614569472,1233262425614569472,1582867649000,2020-02-28,00:27:29,EDT,1064603540956565504,govtimwalz,Governor Tim Walz,,"Great news out of the MN House tonight! The red flag law and background check bills are commonsense pieces of legislation that will reduce gun violence in our state.

It’s now time for the Senate to stand on the side of Minnesotans — not the gun lobby — and pass this bill. #mnleg https://twitter.com/StarTribune/status/1233216499680206853 …",[],['https://twitter.com/StarTribune/status/1233216499680206853'],[],69,62,569,['#mnleg'],[],https://twitter.com/GovTimWalz/status/1233262425614569472,False,https://twitter.com/StarTribune/status/1233216499680206853,0,,,,,,,"[{'user_id': '1064603540956565504', 'username': 'GovTimWalz'}]",,,,
1233041629126299650,1233041629126299650,1582815007000,2020-02-27,09:50:07,EDT,1064603540956565504,govtimwalz,Governor Tim Walz,,"Thank you to Pilgrim Lutheran Church for the beautiful Ash Wednesday service last night. This Lent season, Pope Francis is giving folks something to think about and asking everyone to spread more kindness. https://www.businessinsider.com/pope-francis-calls-for-end-to-trolling-for-lent-2020-2 …",[],['https://www.businessinsider.com/pope-francis-calls-for-end-to-trolling-for-lent-2020-2'],[],6,8,38,[],[],https://twitter.com/GovTimWalz/status/1233041629126299650,False,,0,,,,,,,"[{'user_id': '1064603540956565504', 'username': 'GovTimWalz'}]",,,,
1232853973176115207,1232853973176115207,1582770267000,2020-02-26,21:24:27,EDT,1064603540956565504,govtimwalz,Governor Tim Walz,,"This is an incredible step to ensuring ALL Minnesotans with diabetes can afford the medicine they need to survive. Thank you to the #insulin4all advocates and legislators who worked to pass this.

Now it’s time for the Senate to do the same. I’m ready to sign it into law. #mnleg https://twitter.com/mnhouseDFL/status/1232850615476215810 …",[],['https://twitter.com/mnhouseDFL/status/1232850615476215810'],[],12,88,453,"['#insulin4all', '#mnleg']",[],https://twitter.com/GovTimWalz/status/1232853973176115207,False,https://twitter.com/mnhouseDFL/status/1232850615476215810,0,,,,,,,"[{'user_id': '1064603540956565504', 'username': 'GovTimWalz'}]",,,,
1232841602625830912,1232841602625830912,1582767317000,2020-02-26,20:35:17,EDT,1064603540956565504,govtimwalz,Governor Tim Walz,,"School bus drivers are unsung heroes, transporting 760,000 MN students to and from school each day safely.

I am honored to proclaim today School Bus Driver Appreciation Day to recognize the invaluable contribution they make to education and student safety. #OneMinnesota pic.twitter.com/4bESH3Mnal",[],[],['https://pbs.twimg.com/media/ERvu5sfWoAE2Ekw.jpg'],1,23,195,['#oneminnesota'],[],https://twitter.com/GovTimWalz/status/1232841602625830912,False,,0,,,,,,,"[{'user_id': '1064603540956565504', 'username': 'GovTimWalz'}]",,,,
1232744184727134212,1231807708673839104,1582744091000,2020-02-26,14:08:11,EDT,1064603540956565504,govtimwalz,Governor Tim Walz,,"Hi Ryan, you can write us a message on our website here:  https://mn.gov/governor/contact …. Thanks!","['ryanfiereck', 'mcricker']",['https://mn.gov/governor/contact'],[],1,0,1,[],[],https://twitter.com/GovTimWalz/status/1232744184727134212,False,,0,,,,,,,"[{'user_id': '1064603540956565504', 'username': 'GovTimWalz'}, {'user_id': '126626971', 'username': 'RyanFiereck'}, {'user_id': '19754093', 'username': 'mcricker'}]",,,,
1232456831227682816,1232456828119699457,1582675581000,2020-02-25,19:06:21,EDT,1064603540956565504,govtimwalz,Governor Tim Walz,,"That’s why today we proposed $250,000 in funding to help farmers make safety investments and prevent future tragedies. #OneMinnesota #mnleg https://minnesota.cbslocal.com/2020/02/25/momma-on-a-mission-backs-governor-walzs-call-for-farm-safety-money/ …",[],['https://minnesota.cbslocal.com/2020/02/25/momma-on-a-mission-backs-governor-walzs-call-for-farm-safety-money/'],[],4,0,7,"['#oneminnesota', '#mnleg']",[],https://twitter.com/GovTimWalz/status/1232456831227682816,False,,0,,,,,,,"[{'user_id': '1064603540956565504', 'username': 'GovTimWalz'}]",,,,
1232456828119699457,1232456828119699457,1582675580000,2020-02-25,19:06:20,EDT,1064603540956565504,govtimwalz,Governor Tim Walz,Minnesota State Capitol,"As someone who grew up on a farm, my heart breaks to hear about the recent injuries and deaths from farm accidents. Thank you to Michele Gran, who lost her 18-year-old son in a grain bin accident, for sharing her story and advocating for stronger farm safety. pic.twitter.com/WnVzytVv64 – at Minnesota State Capitol",[],[],['https://pbs.twimg.com/media/ERqQ8xLXkAAJ6Hs.jpg'],4,8,43,[],[],https://twitter.com/GovTimWalz/status/1232456828119699457,False,,0,,,,,,,"[{'user_id': '1064603540956565504', 'username': 'GovTimWalz'}]",,,,
1232436144094105600,1232436144094105600,1582670648000,2020-02-25,17:44:08,EDT,1064603540956565504,govtimwalz,Governor Tim Walz,,Heartbreaking news out of Alexandria. Thank you to our first responders and firefighters for your tireless work to keep Minnesotans safe. My team and I are monitoring the situation and thinking of the people of Alexandria. https://www.echopress.com/news/fires/4968670-Update-1150-a.m.-About-120-firefighters-battle-blaze-in-downtown-Alexandria …,[],['https://www.echopress.com/news/fires/4968670-Update-1150-a.m.-About-120-firefighters-battle-blaze-in-downtown-Alexandria'],[],4,11,49,[],[],https://twitter.com/GovTimWalz/status/1232436144094105600,False,,0,,,,,,,"[{'user_id': '1064603540956565504', 'username': 'GovTimWalz'}]",,,,
1232398444326682626,1232398444326682626,1582661660000,2020-02-25,15:14:20,EDT,1064603540956565504,govtimwalz,Governor Tim Walz,,This is a beautiful story about a community coming together to unite around their love for the local high school sports teams. #OneMinnesota http://www.startribune.com/minnesota-s-austin-high-school-has-a-melting-pot-athletics-program/567798502/ …,[],['http://www.startribune.com/minnesota-s-austin-high-school-has-a-melting-pot-athletics-program/567798502/'],[],3,4,48,['#oneminnesota'],[],https://twitter.com/GovTimWalz/status/1232398444326682626,False,,0,,,,,,,"[{'user_id': '1064603540956565504', 'username': 'GovTimWalz'}]",,,,
1232340147879981063,1232340147879981063,1582647761000,2020-02-25,11:22:41,EDT,1064603540956565504,govtimwalz,Governor Tim Walz,,"Too many Minnesota families have lost loved ones to preventable farming accidents. That’s why I’m proposing new funding for safety measures like tractor rollover protection and grain bin safety equipment.

🎥:  https://www.facebook.com/GovTimWalz/videos/240168087000660/ … pic.twitter.com/0JiqVis9aM",[],['https://www.facebook.com/GovTimWalz/videos/240168087000660/'],['https://pbs.twimg.com/media/ERom0aPW4AEPseW.jpg'],3,10,45,[],[],https://twitter.com/GovTimWalz/status/1232340147879981063,False,,0,,,,,,,"[{'user_id': '1064603540956565504', 'username': 'GovTimWalz'}]",,,,
1232125514028142592,1232125514028142592,1582596588000,2020-02-24,21:09:48,EDT,1064603540956565504,govtimwalz,Governor Tim Walz,,"That’s right, I wore my 1980 Miracle on Ice jersey all weekend long.

Thank you to everyone who joined us this weekend as I proclaimed it the ""Greatest Day Celebration"" in MN to honor one of the greatest sports moment in American history. 🏒 #MiracleOnIce pic.twitter.com/cFr5I522L2",[],[],"['https://pbs.twimg.com/media/ERljnyTWkAE4mz1.jpg', 'https://pbs.twimg.com/media/ERljnyVXYAAyBqd.jpg', 'https://pbs.twimg.com/media/ERljnySXkAA4v_7.jpg']",6,12,163,['#miracleonice'],[],https://twitter.com/GovTimWalz/status/1232125514028142592,False,,0,,,,,,,"[{'user_id': '1064603540956565504', 'username': 'GovTimWalz'}]",,,,
