id,conversation_id,created_at,date,time,timezone,user_id,username,name,place,tweet,mentions,urls,photos,replies_count,retweets_count,likes_count,hashtags,cashtags,link,retweet,quote_url,video,near,geo,source,user_rt_id,user_rt,retweet_id,reply_to,retweet_date,translate,trans_src,trans_dest
1243657296661475329,1243657296661475329,1585345980000,2020-03-27,17:53:00,EDT,1064603540956565504,govtimwalz,Governor Tim Walz,,"I’m grateful for @LtGovFlanagan’s partnership and leadership now more than ever. While we’re keeping distance from each other, we’re responding to #COVIDー19 as a team.  https://www.minnpost.com/state-government/2020/03/lt-gov-peggy-flanagan-has-been-out-of-sight-during-the-states-covid-19-response-thats-part-of-the-plan/ … #StayHomeMN",['ltgovflanagan'],['https://www.minnpost.com/state-government/2020/03/lt-gov-peggy-flanagan-has-been-out-of-sight-during-the-states-covid-19-response-thats-part-of-the-plan/'],[],25,17,394,"['#covidー19', '#stayhomemn']",[],https://twitter.com/GovTimWalz/status/1243657296661475329,False,,0,,,,,,,"[{'user_id': '1064603540956565504', 'username': 'GovTimWalz'}, {'user_id': '1064636307257860096', 'username': 'LtGovFlanagan'}]",,,,
1243613256695963648,1243613256695963648,1585335480000,2020-03-27,14:58:00,EDT,1064603540956565504,govtimwalz,Governor Tim Walz,,"Minnesota’s two-week Stay at Home order takes effect tonight at 11:59. Here’s what’s open and what’s closed. 
 
Still have questions? Head to  http://mn.gov/stayhomemn  for resources and answers to frequently asked questions. 
 
Let’s keep fighting #COVIDー19, together. #StayHomeMN pic.twitter.com/GNIliXf6lK",[],['http://mn.gov/stayhomemn'],['https://pbs.twimg.com/media/EUIm1JEX0AcbfEK.jpg'],122,350,739,"['#covidー19', '#stayhomemn']",[],https://twitter.com/GovTimWalz/status/1243613256695963648,False,,0,,,,,,,"[{'user_id': '1064603540956565504', 'username': 'GovTimWalz'}]",,,,
1243590051335999488,1243590051335999488,1585329947000,2020-03-27,13:25:47,EDT,1064603540956565504,govtimwalz,Governor Tim Walz,,"We’re in uncharted waters, but we’re rowing the boat together. #StayHomeMN https://twitter.com/GopherFootball/status/1242920871334903808 …",[],['https://twitter.com/GopherFootball/status/1242920871334903808'],[],29,155,1596,['#stayhomemn'],[],https://twitter.com/GovTimWalz/status/1243590051335999488,False,https://twitter.com/GopherFootball/status/1242920871334903808,0,,,,,,,"[{'user_id': '1064603540956565504', 'username': 'GovTimWalz'}]",,,,
1243334419336880129,1243334419336880129,1585269000000,2020-03-26,20:30:00,EDT,1064603540956565504,govtimwalz,Governor Tim Walz,,"In collaboration with our Children’s Cabinet, six Minnesota foundations today joined @ThinkSmallMN in launching a statewide child care program. I’m proud to support this effort, which provides invaluable education and services to our state’s emergency response. pic.twitter.com/NajElZECSc",['thinksmallmn'],[],['https://pbs.twimg.com/media/EUEmP_cWAAEuvKn.jpg'],14,50,283,[],[],https://twitter.com/GovTimWalz/status/1243334419336880129,False,,0,,,,,,,"[{'user_id': '1064603540956565504', 'username': 'GovTimWalz'}, {'user_id': '40323573', 'username': 'ThinkSmallMN'}]",,,,
1243316299993841666,1243316299993841666,1585264680000,2020-03-26,19:18:00,EDT,1064603540956565504,govtimwalz,Governor Tim Walz,,"The Legislature came together in a quick, bipartisan fashion to pass our proposed #COVIDー19 legislation. I look forward to signing these bills to keep our state working🛠️, support our food systems🌽, care for children of emergency workers🦺, and more. https://www.startribune.com/lawmakers-tackle-covid-19-aid-as-minnesota-records-2nd-death/569128812/ …",[],['https://www.startribune.com/lawmakers-tackle-covid-19-aid-as-minnesota-records-2nd-death/569128812/'],[],35,89,677,['#covidー19'],[],https://twitter.com/GovTimWalz/status/1243316299993841666,False,,0,,,,,,,"[{'user_id': '1064603540956565504', 'username': 'GovTimWalz'}]",,,,
1243299071135277067,1243299071135277067,1585260572000,2020-03-26,18:09:32,EDT,1064603540956565504,govtimwalz,Governor Tim Walz,,"Can’t tell you how much @GwenWalz and I appreciate all you’re doing to step up and protect your neighbors during the #COVIDー19 pandemic. Stay healthy, Minnesota. #StayHomeMN pic.twitter.com/m5aZaoD7px",['gwenwalz'],[],[],141,182,2704,"['#covidー19', '#stayhomemn']",[],https://twitter.com/GovTimWalz/status/1243299071135277067,False,,1,,,,,,,"[{'user_id': '1064603540956565504', 'username': 'GovTimWalz'}, {'user_id': '1087377002443796481', 'username': 'GwenWalz'}]",,,,
1243196329448427521,1243196328290725889,1585236077000,2020-03-26,11:21:17,EDT,1064603540956565504,govtimwalz,Governor Tim Walz,,I want to thank all of the health care providers who are working around the clock to keep Minnesotans safe and healthy and prepare us for the weeks ahead. #StayHomeMN pic.twitter.com/KKt3jsOQkw,[],[],['https://pbs.twimg.com/media/EUCbdNuWsAEaQZt.jpg'],24,144,857,['#stayhomemn'],[],https://twitter.com/GovTimWalz/status/1243196329448427521,False,,0,,,,,,,"[{'user_id': '1064603540956565504', 'username': 'GovTimWalz'}]",,,,
1243196328290725889,1243196328290725889,1585236076000,2020-03-26,11:21:16,EDT,1064603540956565504,govtimwalz,Governor Tim Walz,,"The health and safety of Minnesotans is my top priority. The COVID-19 pandemic presents unprecedented challenges. During this Stay at Home order, I will work with our world-renowned health care sector to build out hospital capacity and increase access to life-saving equipment.",[],[],[],96,115,1532,[],[],https://twitter.com/GovTimWalz/status/1243196328290725889,False,,0,,,,,,,"[{'user_id': '1064603540956565504', 'username': 'GovTimWalz'}]",,,,
1242964985011003393,1242964985011003393,1585180920000,2020-03-25,20:02:00,EDT,1064603540956565504,govtimwalz,Governor Tim Walz,,"I urge you not to take our Stay at Home Order as an opportunity to stockpile more than you need. Our stores will have food and other necessary supplies, and our grocery store workers are keeping things stocked. This is about social distancing and taking precautions to save lives. pic.twitter.com/N7VCtMAjpX",[],[],['https://pbs.twimg.com/media/ET-u8s1WsAMvVjL.jpg'],199,1707,7363,[],[],https://twitter.com/GovTimWalz/status/1242964985011003393,False,,0,,,,,,,"[{'user_id': '1064603540956565504', 'username': 'GovTimWalz'}]",,,,
1242896257913442305,1242896254839017472,1585164534000,2020-03-25,15:28:54,EDT,1064603540956565504,govtimwalz,Governor Tim Walz,,"These are trying times. But we are Minnesotans. We see challenges, and we tackle them. No matter how daunting the challenge; no matter how dark the times; Minnesota has always risen up—by coming together. If we unite as One Minnesota, we will save lives. #StayHomeMN pic.twitter.com/pAOStd1NG2",[],[],['https://pbs.twimg.com/media/ET-nYiMX0AEEFSf.jpg'],169,1001,1727,['#stayhomemn'],[],https://twitter.com/GovTimWalz/status/1242896257913442305,False,,0,,,,,,,"[{'user_id': '1064603540956565504', 'username': 'GovTimWalz'}]",,,,
1242896256348848130,1242896254839017472,1585164534000,2020-03-25,15:28:54,EDT,1064603540956565504,govtimwalz,Governor Tim Walz,,"The virus will still be here when this two-week period is over, but we’ll be better prepared. We will work with our health care sector, manufacturers, business community, and strong-spirited Minnesotans across the state to tackle this virus head on. #StayHomeMN pic.twitter.com/pTSxsNdgqT",[],[],['https://pbs.twimg.com/media/ET-nTBkXgAIk9Q7.jpg'],57,342,1010,['#stayhomemn'],[],https://twitter.com/GovTimWalz/status/1242896256348848130,False,,0,,,,,,,"[{'user_id': '1064603540956565504', 'username': 'GovTimWalz'}]",,,,
1242896254839017472,1242896254839017472,1585164533000,2020-03-25,15:28:53,EDT,1064603540956565504,govtimwalz,Governor Tim Walz,,"We must take bold action to save the lives of Minnesotans. As a former Command Sergeant Major in the Army National Guard, I believe in having a plan – which is why I’m directing Minnesotans to stay at home and limit their movements to essential services. #StayHomeMN pic.twitter.com/W2TAejwnBs",[],[],['https://pbs.twimg.com/media/ET-nKG8XgAED1oS.jpg'],417,2228,5368,['#stayhomemn'],[],https://twitter.com/GovTimWalz/status/1242896254839017472,False,,0,,,,,,,"[{'user_id': '1064603540956565504', 'username': 'GovTimWalz'}]",,,,
1242892136976199681,1242892136976199681,1585163551000,2020-03-25,15:12:31,EDT,1064603540956565504,govtimwalz,Governor Tim Walz,,The health and safety of Minnesotans is my top priority. I’m providing an update on our state’s response to COVID-19 and what this means for our neighbors and our loved ones. Tune in:  https://www.facebook.com/GovTimWalz/videos/536202673961023/?v=536202673961023 … #StayHomeMN pic.twitter.com/NeiZdV5Uki,[],['https://www.facebook.com/GovTimWalz/videos/536202673961023/?v=536202673961023'],['https://pbs.twimg.com/media/ET-jua9XgAIhR1g.jpg'],197,854,1981,['#stayhomemn'],[],https://twitter.com/GovTimWalz/status/1242892136976199681,False,,0,,,,,,,"[{'user_id': '1064603540956565504', 'username': 'GovTimWalz'}]",,,,
1242583702120673288,1242583685054058497,1585090015000,2020-03-24,18:46:55,EDT,1064603540956565504,govtimwalz,Governor Tim Walz,,And the final encouraging statistic for today: pic.twitter.com/4jDzTmBa8V,[],[],['https://pbs.twimg.com/media/ET6LSiRWkAUeLUu.jpg'],51,10,697,[],[],https://twitter.com/GovTimWalz/status/1242583702120673288,False,,0,,,,,,,"[{'user_id': '1064603540956565504', 'username': 'GovTimWalz'}]",,,,
1242583695468486657,1242583685054058497,1585090013000,2020-03-24,18:46:53,EDT,1064603540956565504,govtimwalz,Governor Tim Walz,,"If you don’t believe me, see for yourself: https://www.google.com/amp/s/minnesota.cbslocal.com/2020/03/24/coronavirus-updates-minnesota-ranked-among-top-states-promoting-social-distancing/amp/ …",[],['https://www.google.com/amp/s/minnesota.cbslocal.com/2020/03/24/coronavirus-updates-minnesota-ranked-among-top-states-promoting-social-distancing/amp/'],[],48,94,541,[],[],https://twitter.com/GovTimWalz/status/1242583695468486657,False,,0,,,,,,,"[{'user_id': '1064603540956565504', 'username': 'GovTimWalz'}]",,,,
1242583685054058497,1242583685054058497,1585090011000,2020-03-24,18:46:51,EDT,1064603540956565504,govtimwalz,Governor Tim Walz,,"Thank you, Minnesota. You’re clearly making sacrifices and doing your part to make sure our hospitals have the supplies necessary to keep Minnesotans safe, and the data backs that up. #StayHomeMN pic.twitter.com/uaBgr3YGVH",[],[],[],288,273,3436,['#stayhomemn'],[],https://twitter.com/GovTimWalz/status/1242583685054058497,False,,1,,,,,,,"[{'user_id': '1064603540956565504', 'username': 'GovTimWalz'}]",,,,
1242235931047985154,1242235931047985154,1585007100000,2020-03-23,19:45:00,EDT,1064603540956565504,govtimwalz,Governor Tim Walz,,Today I suspended evictions in Minnesota. COVID-19 is causing financial hardship for families across the state and we must ensure everyone can #StayHomeMN. pic.twitter.com/xpBsFis6Tc,[],[],['https://pbs.twimg.com/media/ET0fCqFXkAElAgK.png'],238,335,2010,['#stayhomemn'],[],https://twitter.com/GovTimWalz/status/1242235931047985154,False,,0,,,,,,,"[{'user_id': '1064603540956565504', 'username': 'GovTimWalz'}]",,,,
1242203970396753920,1242203970396753920,1584999480000,2020-03-23,17:38:00,EDT,1064603540956565504,govtimwalz,Governor Tim Walz,,"To our small businesses facing unprecedented uncertainty: We’re with you. Unemployment Insurance helps, but it’s not enough. That’s why I just signed an Executive Order to provide immediate relief by creating an emergency loan for struggling businesses. pic.twitter.com/quNFQHt3UM",[],[],['https://pbs.twimg.com/media/ET0fqfEWkAM01RW.png'],99,138,689,[],[],https://twitter.com/GovTimWalz/status/1242203970396753920,False,,0,,,,,,,"[{'user_id': '1064603540956565504', 'username': 'GovTimWalz'}]",,,,
1242143372200095744,1242143372200095744,1584985032000,2020-03-23,13:37:12,EDT,1064603540956565504,govtimwalz,Governor Tim Walz,,"This isn’t a typical Monday morning but we’re still hard at work to combat the #COVIDー19 crisis. Minnesotans have been through long winters before, we’ll get through this one like we always do, together. Be safe, and #StayHomeMN. pic.twitter.com/C0PsPyqIQo",[],[],[],439,366,3513,"['#covidー19', '#stayhomemn']",[],https://twitter.com/GovTimWalz/status/1242143372200095744,False,,1,,,,,,,"[{'user_id': '1064603540956565504', 'username': 'GovTimWalz'}]",,,,
1242119413890830336,1242119413890830336,1584979320000,2020-03-23,12:02:00,EDT,1064603540956565504,govtimwalz,Governor Tim Walz,,"Protective gear like face masks are essential for our hospitals, health care facilities, and first responders. The Minnesota National Guard wasted no time delivering these supplies for Minnesotans. Thank you. https://minnesota.cbslocal.com/2020/03/22/minnesota-national-guard-delivered-81000-face-masks-to-mdh-in-response-to-shortage/ …",[],['https://minnesota.cbslocal.com/2020/03/22/minnesota-national-guard-delivered-81000-face-masks-to-mdh-in-response-to-shortage/'],[],62,146,1355,[],[],https://twitter.com/GovTimWalz/status/1242119413890830336,False,,0,,,,,,,"[{'user_id': '1064603540956565504', 'username': 'GovTimWalz'}]",,,,
1242106131180331011,1242106131180331011,1584976153000,2020-03-23,11:09:13,EDT,1064603540956565504,govtimwalz,Governor Tim Walz,,"After learning I had contact with someone who has COVID-19, I plan to lead by example and work from home. I currently have no symptoms and will continue working tirelessly to combat the spread of COVID-19. #StayHomeMN",[],[],[],533,722,6853,['#stayhomemn'],[],https://twitter.com/GovTimWalz/status/1242106131180331011,False,,0,,,,,,,"[{'user_id': '1064603540956565504', 'username': 'GovTimWalz'}]",,,,
1242076296911470592,1242076296911470592,1584969040000,2020-03-23,09:10:40,EDT,1064603540956565504,govtimwalz,Governor Tim Walz,,"It’s going to take every single one of us to fight this virus. Thanks for speaking up, Coach. #StayHomeMN https://twitter.com/Timberwolves/status/1241862455787048960 …",[],['https://twitter.com/Timberwolves/status/1241862455787048960'],[],64,52,490,['#stayhomemn'],[],https://twitter.com/GovTimWalz/status/1242076296911470592,False,https://twitter.com/Timberwolves/status/1241862455787048960,0,,,,,,,"[{'user_id': '1064603540956565504', 'username': 'GovTimWalz'}]",,,,
1241505367118483457,1241505367118483457,1584832920000,2020-03-21,19:22:00,EDT,1064603540956565504,govtimwalz,Governor Tim Walz,,Minnesota’s strength comes from our ability to come together and lift each other up. Thank you @ThinkSmallMN for launching supportive local programs for over 4800 children of essential workers!,['thinksmallmn'],[],[],141,68,901,[],[],https://twitter.com/GovTimWalz/status/1241505367118483457,False,,0,,,,,,,"[{'user_id': '1064603540956565504', 'username': 'GovTimWalz'}, {'user_id': '40323573', 'username': 'ThinkSmallMN'}]",,,,
1241467748561158147,1241467748561158147,1584823951000,2020-03-21,16:52:31,EDT,1064603540956565504,govtimwalz,Governor Tim Walz,,Small businesses across Minnesota are putting the health of their neighbors before their bottom line. This loan assistance will help our state’s businesses recover from the economic hardship caused by COVID-19. https://kstp.com/business/sba-offering-federal-disaster-loans-for-minnesotas-small-businesses-/5680304/ …,[],['https://kstp.com/business/sba-offering-federal-disaster-loans-for-minnesotas-small-businesses-/5680304/'],[],47,116,423,[],[],https://twitter.com/GovTimWalz/status/1241467748561158147,False,,0,,,,,,,"[{'user_id': '1064603540956565504', 'username': 'GovTimWalz'}]",,,,
1241436161190567939,1241436161190567939,1584816420000,2020-03-21,14:47:00,EDT,1064603540956565504,govtimwalz,Governor Tim Walz,,Every Minnesotan deserves access to health coverage during this uncertain time. We worked with @MNsure to set up a special enrollment period to help ensure Minnesotans can receive the care they need during the #COVIDー19 crisis. pic.twitter.com/TGPzilHphJ,['mnsure'],[],['https://pbs.twimg.com/media/ETluBcaWkAI5pz8.png'],35,193,588,['#covidー19'],[],https://twitter.com/GovTimWalz/status/1241436161190567939,False,,0,,,,,,,"[{'user_id': '1064603540956565504', 'username': 'GovTimWalz'}, {'user_id': '1130039840', 'username': 'MNsure'}]",,,,
1241406329509609475,1241406329509609475,1584809307000,2020-03-21,12:48:27,EDT,1064603540956565504,govtimwalz,Governor Tim Walz,,"Health officials today announced Minnesota's first death due to COVID-19. Gwen and I extend our deepest sympathy to their loved ones during this time of loss. As the virus continues to spread in Minnesota, we must all continue to do everything we can to keep each other safe.",[],[],[],196,275,2215,[],[],https://twitter.com/GovTimWalz/status/1241406329509609475,False,,0,,,,,,,"[{'user_id': '1064603540956565504', 'username': 'GovTimWalz'}]",,,,
1241155813848141824,1241155813848141824,1584749580000,2020-03-20,20:13:00,EDT,1064603540956565504,govtimwalz,Governor Tim Walz,,"Thank you to the nearly 1000 Minnesota child care providers who've agreed to continue serving children of emergency workers during the COVID-19 crisis. All child care providers, including those who have had to close temporarily, provide critical care for our littlest Minnesotans.",[],[],[],82,393,3943,[],[],https://twitter.com/GovTimWalz/status/1241155813848141824,False,,0,,,,,,,"[{'user_id': '1064603540956565504', 'username': 'GovTimWalz'}]",,,,
1241138681345384449,1241138681345384449,1584745495000,2020-03-20,19:04:55,EDT,1064603540956565504,govtimwalz,Governor Tim Walz,,No one should be targeting Minnesotans for personal gain during the #COVIDー19 crisis. Today I signed an Order banning price gouging during times of emergency. Minnesotans can report instances of price gouging by calling 800-657-3787. https://www.fox9.com/news/minnesota-governor-signs-executive-order-prohibiting-price-gouging-amid-covid-19-pandemic …,[],['https://www.fox9.com/news/minnesota-governor-signs-executive-order-prohibiting-price-gouging-amid-covid-19-pandemic'],[],75,318,1435,['#covidー19'],[],https://twitter.com/GovTimWalz/status/1241138681345384449,False,,0,,,,,,,"[{'user_id': '1064603540956565504', 'username': 'GovTimWalz'}]",,,,
1241095186123567106,1241095186123567106,1584735125000,2020-03-20,16:12:05,EDT,1064603540956565504,govtimwalz,Governor Tim Walz,,"Thank you @Twins for getting the word out to Minnesotans to #StayHomeMN. Together we can #FlattenTheCurve to protect our family, friends, and neighbors. https://twitter.com/JakeOdorizzi/status/1240754767510544385 …",['twins'],['https://twitter.com/JakeOdorizzi/status/1240754767510544385'],[],62,117,808,"['#stayhomemn', '#flattenthecurve']",[],https://twitter.com/GovTimWalz/status/1241095186123567106,False,https://twitter.com/JakeOdorizzi/status/1240754767510544385,0,,,,,,,"[{'user_id': '1064603540956565504', 'username': 'GovTimWalz'}, {'user_id': '39397148', 'username': 'Twins'}]",,,,
1241079500856754176,1241079500856754176,1584731385000,2020-03-20,15:09:45,EDT,1064603540956565504,govtimwalz,Governor Tim Walz,,"I'm joining our team at @mnhealth for a daily briefing on #COVIDー19. Tune in.

🎥: https://www.facebook.com/GovTimWalz/videos/199646284697365/?sfnsn=mo&d=n&vh=e …",['mnhealth'],['https://www.facebook.com/GovTimWalz/videos/199646284697365/?sfnsn=mo&d=n&vh=e'],[],64,38,184,['#covidー19'],[],https://twitter.com/GovTimWalz/status/1241079500856754176,False,,0,,,,,,,"[{'user_id': '1064603540956565504', 'username': 'GovTimWalz'}, {'user_id': '25149628', 'username': 'mnhealth'}]",,,,
1241061302673510401,1241061302673510401,1584727047000,2020-03-20,13:57:27,EDT,1064603540956565504,govtimwalz,Governor Tim Walz,,I’m joining our team at the @mnhealth for a daily briefing on COVID-19 at 2pm. Tune in 🎥:  http://www.facebook.com/GovTimWalz/  pic.twitter.com/CFFYVMovm2,['mnhealth'],['http://www.facebook.com/GovTimWalz/'],['https://pbs.twimg.com/media/ETkiqpXWkAA2LUS.jpg'],56,77,194,[],[],https://twitter.com/GovTimWalz/status/1241061302673510401,False,,0,,,,,,,"[{'user_id': '1064603540956565504', 'username': 'GovTimWalz'}, {'user_id': '25149628', 'username': 'mnhealth'}]",,,,
1240779545436971008,1240779545436971008,1584659870000,2020-03-19,19:17:50,EDT,1064603540956565504,govtimwalz,Governor Tim Walz,,Spread the word: Stay home if you can and save lives. #StayHomeMN pic.twitter.com/n9tovMHliS,[],[],['https://pbs.twimg.com/media/ETgiWpLWsAA4CIv.jpg'],206,967,2233,['#stayhomemn'],[],https://twitter.com/GovTimWalz/status/1240779545436971008,False,,0,,,,,,,"[{'user_id': '1064603540956565504', 'username': 'GovTimWalz'}]",,,,
1240427758494330881,1240427758494330881,1584575998000,2020-03-18,19:59:58,EDT,1064603540956565504,govtimwalz,Governor Tim Walz,,Taking care of one another is one tradition all Minnesotans share. I applaud this coalition of statewide partners for launching the Minnesota Disaster Recovery Fund to respond to the unprecedented economic challenges our neighbors are facing. #OneMinnesota https://twitter.com/FollowMCF/status/1240285156566540289 …,[],['https://twitter.com/FollowMCF/status/1240285156566540289'],[],33,70,361,['#oneminnesota'],[],https://twitter.com/GovTimWalz/status/1240427758494330881,False,https://twitter.com/FollowMCF/status/1240285156566540289,0,,,,,,,"[{'user_id': '1064603540956565504', 'username': 'GovTimWalz'}]",,,,
1240368486393819137,1240368486393819137,1584561866000,2020-03-18,16:04:26,EDT,1064603540956565504,govtimwalz,Governor Tim Walz,,"It is more important than ever that we pull together, take care of each other, and stay informed on the #COVIDー19 pandemic.

🎥: https://www.facebook.com/GovTimWalz/videos/2805619039475492/?sfnsn=mo&d=n&vh=e …",[],['https://www.facebook.com/GovTimWalz/videos/2805619039475492/?sfnsn=mo&d=n&vh=e'],[],67,58,342,['#covidー19'],[],https://twitter.com/GovTimWalz/status/1240368486393819137,False,,0,,,,,,,"[{'user_id': '1064603540956565504', 'username': 'GovTimWalz'}]",,,,
1240297659451224065,1240297659451224065,1584544980000,2020-03-18,11:23:00,EDT,1064603540956565504,govtimwalz,Governor Tim Walz,,"As our Asian American community faces heightened discrimination due to COVID-19, my message is clear: Viruses don’t discriminate and neither should we. #OneMinnesota",[],[],[],198,1420,6591,['#oneminnesota'],[],https://twitter.com/GovTimWalz/status/1240297659451224065,False,,0,,,,,,,"[{'user_id': '1064603540956565504', 'username': 'GovTimWalz'}]",,,,
1240069153567821824,1240069153567821824,1584490500000,2020-03-17,20:15:00,EDT,1064603540956565504,govtimwalz,Governor Tim Walz,,"Minnesotans, do you have questions about COVID-19? Call the Department of Health hotline, open every day between 7AM and 7PM: 
Metro: 651-297-1304
Greater MN: 1-800-657-3504",[],[],[],58,284,474,[],[],https://twitter.com/GovTimWalz/status/1240069153567821824,False,,0,,,,,,,"[{'user_id': '1064603540956565504', 'username': 'GovTimWalz'}]",,,,
1240027881633447939,1240027881633447939,1584480660000,2020-03-17,17:31:00,EDT,1064603540956565504,govtimwalz,Governor Tim Walz,,"We must do everything we can to support workers who are negatively impacted by #COVIDー19. That is why I signed an Executive Order yesterday to ensure Minnesotans who are not able to work due to COVID-19 have access to Unemployment Insurance. More info:
 https://bit.ly/392GtGx  pic.twitter.com/xIyzs8lF5I",[],['https://bit.ly/392GtGx'],['https://pbs.twimg.com/media/ETVyPL6WsAAR3F5.jpg'],66,177,509,['#covidー19'],[],https://twitter.com/GovTimWalz/status/1240027881633447939,False,,0,,,,,,,"[{'user_id': '1064603540956565504', 'username': 'GovTimWalz'}]",,,,
1240025551496232961,1240025551496232961,1584480104000,2020-03-17,17:21:44,EDT,1064603540956565504,govtimwalz,Governor Tim Walz,,"Due to COVID-19, I sent a letter to House Speaker @melissahortman today announcing that I will no longer be giving my State of the State address in person. I will instead televise my address to the legislature and the State of Minnesota on a future date. pic.twitter.com/ZNmed6sibX",['melissahortman'],[],['https://pbs.twimg.com/media/ETV0fO1WAAE7Nck.png'],9,35,257,[],[],https://twitter.com/GovTimWalz/status/1240025551496232961,False,,0,,,,,,,"[{'user_id': '1064603540956565504', 'username': 'GovTimWalz'}, {'user_id': '159633273', 'username': 'melissahortman'}]",,,,
1240006755557552131,1240006755557552131,1584475623000,2020-03-17,16:07:03,EDT,1064603540956565504,govtimwalz,Governor Tim Walz,,"Our #1 priority is combating #COVID-19, but doesn’t mean democracy stops. Today I signed measures to: 
•Improve safety on Hwy 14
•Provide emergency assistance after natural disasters
•Offer low-interest loans to farmers
Whatever comes our way, we're still #OneMinnesota. pic.twitter.com/ZcGAuYz6Yp",[],[],['https://pbs.twimg.com/media/ETVjK1fWkAE8Obo.jpg'],41,65,722,"['#covid', '#oneminnesota']",[],https://twitter.com/GovTimWalz/status/1240006755557552131,False,,0,,,,,,,"[{'user_id': '1064603540956565504', 'username': 'GovTimWalz'}]",,,,
1239988646046044163,1239988646046044163,1584471305000,2020-03-17,14:55:05,EDT,1064603540956565504,govtimwalz,Governor Tim Walz,,"Listen to @MHealthFairview: stay home, avoid big groups and wash your hands. #FlattenTheCurve #StayHomeMN https://twitter.com/MHealthFairview/status/1239722967975841792 …",['mhealthfairview'],['https://twitter.com/MHealthFairview/status/1239722967975841792'],[],38,46,112,"['#flattenthecurve', '#stayhomemn']",[],https://twitter.com/GovTimWalz/status/1239988646046044163,False,https://twitter.com/MHealthFairview/status/1239722967975841792,0,,,,,,,"[{'user_id': '1064603540956565504', 'username': 'GovTimWalz'}, {'user_id': '224372032', 'username': 'MHealthFairview'}]",,,,
