id,conversation_id,created_at,date,time,timezone,user_id,username,name,place,tweet,mentions,urls,photos,replies_count,retweets_count,likes_count,hashtags,cashtags,link,retweet,quote_url,video,near,geo,source,user_rt_id,user_rt,retweet_id,reply_to,retweet_date,translate,trans_src,trans_dest
1232058618310266881,1232058618310266881,1582580639000,2020-02-24,16:43:59,EDT,1064603540956565504,govtimwalz,Governor Tim Walz,,I stand with my fellow governors across the country to express concern about the Department of Defense’s planned reprogramming of National Guard funding for construction projects along the southern border. https://twitter.com/NatlGovsAssoc/status/1231973972968976385 …,[],['https://twitter.com/NatlGovsAssoc/status/1231973972968976385'],[],21,22,105,[],[],https://twitter.com/GovTimWalz/status/1232058618310266881,False,https://twitter.com/NatlGovsAssoc/status/1231973972968976385,0,,,,,,,"[{'user_id': '1064603540956565504', 'username': 'GovTimWalz'}]",,,,
1231771815703347201,1231771815703347201,1582512260000,2020-02-23,21:44:20,EDT,1064603540956565504,govtimwalz,Governor Tim Walz,,Thank you to the Progressive Baptist Church and @MayorCarter for welcoming Gwen and I this morning. I was humbled to join you as we celebrate #BlackHistoryMonth and honor the sacrifices and contributions made by generations of African Americans to our state and our country. pic.twitter.com/l7p3AQJ4X6,['mayorcarter'],[],['https://pbs.twimg.com/media/ERgh73oX0AAbssa.jpg'],6,7,55,['#blackhistorymonth'],[],https://twitter.com/GovTimWalz/status/1231771815703347201,False,,0,,,,,,,"[{'user_id': '1064603540956565504', 'username': 'GovTimWalz'}, {'user_id': '936293669581279232', 'username': 'MayorCarter'}]",,,,
1230997925217685506,1230997925217685506,1582327750000,2020-02-21,18:29:10,EDT,1064603540956565504,govtimwalz,Governor Tim Walz,,"More than 3 years ago, my nephew Jake was in an accident in the Boundary Waters that killed his dad (my brother) and left him with life-threatening injuries. Today, we’re cheering Jake on at the MN state high school swimming tournament.

I’m so proud of him. Let’s go, Jake! pic.twitter.com/S0pQJ9rDBI",[],[],['https://pbs.twimg.com/media/ERViFjfXkAYDlM_.jpg'],21,56,2742,[],[],https://twitter.com/GovTimWalz/status/1230997925217685506,False,,0,,,,,,,"[{'user_id': '1064603540956565504', 'username': 'GovTimWalz'}]",,,,
1230679808549556224,1230679808549556224,1582251905000,2020-02-20,21:25:05,EDT,1064603540956565504,govtimwalz,Governor Tim Walz,,"My team and I are closely monitoring the fire in Becker, and we are grateful to local law enforcement and firefighters who have been working tirelessly to control the situation.

You can stay up-to-date on the situation from @mnhealth and @MnPCA at the link below. https://twitter.com/mnhealth/status/1230659476719644673 …","['mnhealth', 'mnpca']",['https://twitter.com/mnhealth/status/1230659476719644673'],[],5,6,33,[],[],https://twitter.com/GovTimWalz/status/1230679808549556224,False,https://twitter.com/mnhealth/status/1230659476719644673,0,,,,,,,"[{'user_id': '1064603540956565504', 'username': 'GovTimWalz'}, {'user_id': '25149628', 'username': 'mnhealth'}, {'user_id': '78662676', 'username': 'MnPCA'}]",,,,
1230612601870090241,1230612601870090241,1582235882000,2020-02-20,16:58:02,EDT,1064603540956565504,govtimwalz,Governor Tim Walz,,"Safe and stable housing is an essential building block to success, but out of reach for too many. That's why we're proposing a historic investment in affordable housing.

Thank you to the folks at @JRLCmn for your tireless advocacy on this issue. #homes4all #BuildOneMN pic.twitter.com/KC5WXwL0Rj",['jrlcmn'],[],['https://pbs.twimg.com/media/ERQDoh9X0AYAjVW.jpg'],6,2,22,"['#homes4all', '#buildonemn']",[],https://twitter.com/GovTimWalz/status/1230612601870090241,False,,0,,,,,,,"[{'user_id': '1064603540956565504', 'username': 'GovTimWalz'}, {'user_id': '80347252', 'username': 'JRLCmn'}]",,,,
1230571669745520645,1230571669745520645,1582226123000,2020-02-20,14:15:23,EDT,1064603540956565504,govtimwalz,Governor Tim Walz,,"Hey MN! Are you flying on an airplane soon? Well, not without a new ID.

You will need a REAL ID, Enhanced Driver's License, or another acceptable form of ID before **October 1, 2020** to fly on an airplane or enter federal buildings. RT this video to spread the word! pic.twitter.com/sNYDX5XVq4",[],[],[],40,113,157,[],[],https://twitter.com/GovTimWalz/status/1230571669745520645,False,,1,,,,,,,"[{'user_id': '1064603540956565504', 'username': 'GovTimWalz'}]",,,,
1230486153465356290,1230486153465356290,1582205734000,2020-02-20,08:35:34,EDT,1064603540956565504,govtimwalz,Governor Tim Walz,,"Uprooting the Hmong and Lao community is unjust, immoral, and a betrayal of our country’s patriotic duty to these refugees. That’s why I sent a letter to Secretary of State Mike Pompeo condemning these deportation negotiations. https://www.twincities.com/2020/02/18/walz-trump-administration-deport-mn-hmong-lao-americans/ …",[],['https://www.twincities.com/2020/02/18/walz-trump-administration-deport-mn-hmong-lao-americans/'],[],12,39,181,[],[],https://twitter.com/GovTimWalz/status/1230486153465356290,False,,0,,,,,,,"[{'user_id': '1064603540956565504', 'username': 'GovTimWalz'}]",,,,
1230332622485762048,1230332622485762048,1582169130000,2020-02-19,22:25:30,EDT,1064603540956565504,govtimwalz,Governor Tim Walz,,"Gwen and I are praying for @RepHagedorn as he battles cancer. Thinking of him, @jkcarnah, and their family at this time and wishing him a full recovery.","['rephagedorn', 'jkcarnah']",[],[],2,12,104,[],[],https://twitter.com/GovTimWalz/status/1230332622485762048,False,,0,,,,,,,"[{'user_id': '1064603540956565504', 'username': 'GovTimWalz'}, {'user_id': '1083474782602125318', 'username': 'RepHagedorn'}, {'user_id': '20214593', 'username': 'jkcarnah'}]",,,,
1230271595450634242,1230271595450634242,1582154580000,2020-02-19,18:23:00,EDT,1064603540956565504,govtimwalz,Governor Tim Walz,,Our firefighters put their lives on the line to protect our communities. Today I am proud to be with our MN firefighters at Fire Service Day on the Hill.  We are committed to working towards our shared goal of ensuring every firefighter gets home safely at the end of every shift. pic.twitter.com/5UR5Fq0tjv,[],[],['https://pbs.twimg.com/media/ERLGih8X0AAr1oD.jpg'],1,3,26,[],[],https://twitter.com/GovTimWalz/status/1230271595450634242,False,,0,,,,,,,"[{'user_id': '1064603540956565504', 'username': 'GovTimWalz'}]",,,,
1230262283483267073,1230262283483267073,1582152360000,2020-02-19,17:46:00,EDT,1064603540956565504,govtimwalz,Governor Tim Walz,,"I grieve with the MN families who have lost loved ones in these terrible accidents. As someone who grew up on a farm, I know how important it is that we educate folks on the dangers of farming to help decrease the number of preventable injuries and deaths. https://kbjr6.com/2020/02/16/gov-tim-walz-declares-grain-bin-safety-week-in-minnesota/ …",[],['https://kbjr6.com/2020/02/16/gov-tim-walz-declares-grain-bin-safety-week-in-minnesota/'],[],4,12,60,[],[],https://twitter.com/GovTimWalz/status/1230262283483267073,False,,0,,,,,,,"[{'user_id': '1064603540956565504', 'username': 'GovTimWalz'}]",,,,
1230227135794642944,1230227135794642944,1582143980000,2020-02-19,15:26:20,EDT,1064603540956565504,govtimwalz,Governor Tim Walz,,Ope! Didn’t mean to barge in here @NJGov https://twitter.com/NYTnickc/status/1230142706246012928 …,['njgov'],['https://twitter.com/NYTnickc/status/1230142706246012928'],[],35,104,1364,[],[],https://twitter.com/GovTimWalz/status/1230227135794642944,False,https://twitter.com/NYTnickc/status/1230142706246012928,0,,,,,,,"[{'user_id': '1064603540956565504', 'username': 'GovTimWalz'}, {'user_id': '984819646082797568', 'username': 'NJGov'}]",,,,
1229911210843348993,1229911210843348993,1582068657000,2020-02-18,18:30:57,EDT,1064603540956565504,govtimwalz,Governor Tim Walz,,"I look forward to addressing Minnesotans and #mnleg for my State of the State address on Monday, March 23 at 7:00 pm. You can follow along at #MNSOTS and tune in LIVE on our Facebook page!

📽️➡️  http://facebook.com/GovTimWalz  pic.twitter.com/FNkP4cA39o",[],['http://facebook.com/GovTimWalz'],['https://pbs.twimg.com/media/ERGFub6XsAIerUo.jpg'],4,13,69,"['#mnleg', '#mnsots']",[],https://twitter.com/GovTimWalz/status/1229911210843348993,False,,0,,,,,,,"[{'user_id': '1064603540956565504', 'username': 'GovTimWalz'}]",,,,
1229802438279991299,1229802438279991299,1582042724000,2020-02-18,11:18:44,EDT,1064603540956565504,govtimwalz,Governor Tim Walz,,"In Minnesota, we come together to help each other when our communities are hit by devasting natural disasters. That’s why I’m asking #mnleg to build our state’s savings account to assist communities in times of need. We cannot afford to be unprepared.

🎥:  https://www.facebook.com/GovTimWalz/videos/200113491055513/ … pic.twitter.com/G1hSLG4eej",[],['https://www.facebook.com/GovTimWalz/videos/200113491055513/'],['https://pbs.twimg.com/media/EREiyfHWoAAarC5.jpg'],6,4,40,['#mnleg'],[],https://twitter.com/GovTimWalz/status/1229802438279991299,False,,0,,,,,,,"[{'user_id': '1064603540956565504', 'username': 'GovTimWalz'}]",,,,
1228792349834215424,1228792349834215424,1581801900000,2020-02-15,16:25:00,EDT,1064603540956565504,govtimwalz,Governor Tim Walz,,Bishop Chilstrom’s life of service made this world a better place. Minnesota grieves this loss with his family. https://www.mprnews.org/story/2020/01/30/rev-herbert-chilstrom-first-bishop-of-elca-dies-at-88 …,[],['https://www.mprnews.org/story/2020/01/30/rev-herbert-chilstrom-first-bishop-of-elca-dies-at-88'],[],1,2,18,[],[],https://twitter.com/GovTimWalz/status/1228792349834215424,False,,0,,,,,,,"[{'user_id': '1064603540956565504', 'username': 'GovTimWalz'}]",,,,
1228480956748660736,1228480956748660736,1581727658000,2020-02-14,19:47:38,EDT,1064603540956565504,govtimwalz,Governor Tim Walz,,"Happy Valentine’s Day to the loves of my life: Gwen, Hope, and Gus. I’m so lucky to call you my family. pic.twitter.com/l1mFdwARcv",[],[],['https://pbs.twimg.com/media/EQxw6xtXkAAnSst.jpg'],6,12,418,[],[],https://twitter.com/GovTimWalz/status/1228480956748660736,False,,0,,,,,,,"[{'user_id': '1064603540956565504', 'username': 'GovTimWalz'}]",,,,
1228441174500872193,1228441165017554944,1581718173000,2020-02-14,17:09:33,EDT,1064603540956565504,govtimwalz,Governor Tim Walz,,We will continue working in partnership to ensure Native women are able to thrive and succeed without having to experience trauma and violence. #mmiw pic.twitter.com/jVMH44UW6U,[],[],['https://pbs.twimg.com/media/EQxMvDGXsAAB2JZ.jpg'],3,5,28,['#mmiw'],[],https://twitter.com/GovTimWalz/status/1228441174500872193,False,,0,,,,,,,"[{'user_id': '1064603540956565504', 'username': 'GovTimWalz'}]",,,,
1228441165017554944,1228441165017554944,1581718171000,2020-02-14,17:09:31,EDT,1064603540956565504,govtimwalz,Governor Tim Walz,,"Today I was honored to join Minnesotans in the March for Missing and Murdered Indigenous Women. Native women face violence at alarmingly high rates. As Governor, I am committed to making Minnesota a state where everyone is safe. #mmiw pic.twitter.com/IPdz3PxMsO",[],[],['https://pbs.twimg.com/media/EQxMuSsWAAUkMMt.jpg'],5,18,126,['#mmiw'],[],https://twitter.com/GovTimWalz/status/1228441165017554944,False,,0,,,,,,,"[{'user_id': '1064603540956565504', 'username': 'GovTimWalz'}]",,,,
1228062307445608448,1228062306262802433,1581627845000,2020-02-13,16:04:05,EDT,1064603540956565504,govtimwalz,Governor Tim Walz,,"I will not stand by as the Trump Administration tries to uproot a community by deporting small business owners, combat veterans who fought alongside American soldiers, and passionate people who have shaped Minnesota’s culture into what it is today.",[],[],[],24,59,277,[],[],https://twitter.com/GovTimWalz/status/1228062307445608448,False,,0,,,,,,,"[{'user_id': '1064603540956565504', 'username': 'GovTimWalz'}]",,,,
1228062306262802433,1228062306262802433,1581627844000,2020-02-13,16:04:04,EDT,1064603540956565504,govtimwalz,Governor Tim Walz,,"Minnesota stands with our Hmong and Lao neighbors, many of whom have called this state home longer than I have. https://twitter.com/MPRnews/status/1227253206218092544 …",[],['https://twitter.com/MPRnews/status/1227253206218092544'],[],15,116,522,[],[],https://twitter.com/GovTimWalz/status/1228062306262802433,False,https://twitter.com/MPRnews/status/1227253206218092544,0,,,,,,,"[{'user_id': '1064603540956565504', 'username': 'GovTimWalz'}]",,,,
1228013918813073409,1228013918813073409,1581616308000,2020-02-13,12:51:48,EDT,1064603540956565504,govtimwalz,Governor Tim Walz,,It’s a Bold North day in Minnesota today. Stay warm out there! #OneMinnesota pic.twitter.com/46CTL58nmU,[],[],['https://pbs.twimg.com/media/EQrIJhyX0AAslVq.jpg'],4,7,103,['#oneminnesota'],[],https://twitter.com/GovTimWalz/status/1228013918813073409,False,,0,,,,,,,"[{'user_id': '1064603540956565504', 'username': 'GovTimWalz'}]",,,,
1227668484018057217,1227668473901441025,1581533950000,2020-02-12,13:59:10,EDT,1064603540956565504,govtimwalz,Governor Tim Walz,,"Investing in this project will not only create more jobs, but will provide access to curbside food waste collection for more than 800,000 residents and reduce greenhouse gas emissions. #BuildOneMN #mnleg pic.twitter.com/auLT9Jeyza",[],[],['https://pbs.twimg.com/media/EQmN-ZQXsAAI_5c.jpg'],2,8,28,"['#buildonemn', '#mnleg']",[],https://twitter.com/GovTimWalz/status/1227668484018057217,False,,0,,,,,,,"[{'user_id': '1064603540956565504', 'username': 'GovTimWalz'}]",,,,
1227668473901441025,1227668473901441025,1581533947000,2020-02-12,13:59:07,EDT,1064603540956565504,govtimwalz,Governor Tim Walz,,Today I toured the Ramsey/Washington Recycling & Energy Center – one of the projects included in my Local Jobs and Projects Plan. #BuildOneMN #mnleg pic.twitter.com/Kojj0oklWn,[],[],['https://pbs.twimg.com/media/EQmN9tgWAAIsXzk.jpg'],1,9,46,"['#buildonemn', '#mnleg']",[],https://twitter.com/GovTimWalz/status/1227668473901441025,False,,0,,,,,,,"[{'user_id': '1064603540956565504', 'username': 'GovTimWalz'}]",,,,
1227440918665605120,1227440894275616768,1581479694000,2020-02-11,22:54:54,EDT,1064603540956565504,govtimwalz,Governor Tim Walz,,"From health care to infrastructure to national security, I’m grateful for the time spent with governors from other states to discuss ways we can work together in a bipartisan way to serve the people of our states. #WeTheStates pic.twitter.com/l5BSXr9HDO",[],[],"['https://pbs.twimg.com/media/EQi-_q0XkAYZIMs.jpg', 'https://pbs.twimg.com/media/EQi-_s9WsAQoedl.jpg', 'https://pbs.twimg.com/media/EQi-_1MX0AUdY6r.jpg', 'https://pbs.twimg.com/media/EQi-_1QXUAI09SD.jpg']",2,3,19,['#wethestates'],[],https://twitter.com/GovTimWalz/status/1227440918665605120,False,,0,,,,,,,"[{'user_id': '1064603540956565504', 'username': 'GovTimWalz'}]",,,,
1227440894275616768,1227440894275616768,1581479688000,2020-02-11,22:54:48,EDT,1064603540956565504,govtimwalz,Governor Tim Walz,,"This past weekend, I joined my fellow governors in Washington, DC for the @NatlGovsAssoc meeting to represent MN at the federal level. We came together to discuss some of the most pressing issues facing our states and innovative solutions to these challenges. #WeTheStates pic.twitter.com/8ZvSJSmun1",['natlgovsassoc'],[],['https://pbs.twimg.com/media/EQi-9K4WsAIr3Fe.jpg'],3,3,27,['#wethestates'],[],https://twitter.com/GovTimWalz/status/1227440894275616768,False,,0,,,,,,,"[{'user_id': '1064603540956565504', 'username': 'GovTimWalz'}, {'user_id': '393615360', 'username': 'NatlGovsAssoc'}]",,,,
1227004024244854790,1227004022315454465,1581375530000,2020-02-10,17:58:50,EDT,1064603540956565504,govtimwalz,Governor Tim Walz,,"Here in Minnesota, I want to thank and uplift the work of the #mnleg United Black Legislative Caucus, who are dedicated to addressing the racial disparities in our state. #BlackHistoryMonth @jeffreyhayden @BobbyJChampion @renamoran @RuthForHouse @mohamudnoor @RepHassan","['jeffreyhayden', 'bobbyjchampion', 'renamoran', 'ruthforhouse', 'mohamudnoor', 'rephassan']",[],[],1,6,33,"['#mnleg', '#blackhistorymonth']",[],https://twitter.com/GovTimWalz/status/1227004024244854790,False,,0,,,,,,,"[{'user_id': '1064603540956565504', 'username': 'GovTimWalz'}, {'user_id': '30380250', 'username': 'jeffreyhayden'}, {'user_id': '417548994', 'username': 'BobbyJChampion'}, {'user_id': '56243144', 'username': 'renamoran'}, {'user_id': '956410801837010944', 'username': 'RuthForHouse'}, {'user_id': '32157077', 'username': 'mohamudnoor'}, {'user_id': '23593966', 'username': 'RepHassan'}]",,,,
1227004022315454465,1227004022315454465,1581375530000,2020-02-10,17:58:50,EDT,1064603540956565504,govtimwalz,Governor Tim Walz,,I’m honored to proclaim February as #BlackHistoryMonth in Minnesota to recognize the generations of African Americans who have risked their lives for justice and who continue to fight for equality today. pic.twitter.com/piIoUQdSyz,[],[],['https://pbs.twimg.com/media/EQcxputXYAEkDn8.jpg'],2,24,94,['#blackhistorymonth'],[],https://twitter.com/GovTimWalz/status/1227004022315454465,False,,0,,,,,,,"[{'user_id': '1064603540956565504', 'username': 'GovTimWalz'}]",,,,
1226879897454424064,1226879897454424064,1581345936000,2020-02-10,09:45:36,EDT,1064603540956565504,govtimwalz,Governor Tim Walz,,"Last week I was proud to convene our Minnesota Congressional Delegation in Washington, DC to talk about important issues facing our state, from infrastructure to health care.

Thank you to my fellow Minnesotans for joining me over lunch! #OneMinnesota pic.twitter.com/T0YW3ZpDsW",[],[],['https://pbs.twimg.com/media/EQbAwutWsAEWWG-.jpg'],29,23,245,['#oneminnesota'],[],https://twitter.com/GovTimWalz/status/1226879897454424064,False,,0,,,,,,,"[{'user_id': '1064603540956565504', 'username': 'GovTimWalz'}]",,,,
1224853581192400896,1224853581192400896,1580862825000,2020-02-04,19:33:45,EDT,1064603540956565504,govtimwalz,Governor Tim Walz,,"Nothing better than Taco Tuesday! 🌮
@ELBURRITOM is one of my favorite restaurants in MN, and I’m glad everyone was safe after the devastating robbery. https://twitter.com/kenterdahl/status/1224837183430955011 …",['elburritom'],['https://twitter.com/kenterdahl/status/1224837183430955011'],[],5,8,49,[],[],https://twitter.com/GovTimWalz/status/1224853581192400896,False,https://twitter.com/kenterdahl/status/1224837183430955011,0,,,,,,,"[{'user_id': '1064603540956565504', 'username': 'GovTimWalz'}, {'user_id': '208121974', 'username': 'ELBURRITOM'}]",,,,
1224827000914894850,1224826999715385345,1580856487000,2020-02-04,17:48:07,EDT,1064603540956565504,govtimwalz,Governor Tim Walz,,"With this funding, organizations across Minnesota will open more than 350 emergency shelter beds – from Minneapolis to Mankato and Rondo to the Range.

This partnership is ensuring more Minnesotans have a warm, safe place to sleep at night.

#OneMinnesota",[],[],[],2,0,23,['#oneminnesota'],[],https://twitter.com/GovTimWalz/status/1224827000914894850,False,,0,,,,,,,"[{'user_id': '1064603540956565504', 'username': 'GovTimWalz'}]",,,,
1224826999715385345,1224826999715385345,1580856487000,2020-02-04,17:48:07,EDT,1064603540956565504,govtimwalz,Governor Tim Walz,,"This past December, we joined philanthropic leaders to launch the Minnesota Winter Homeless Initiative to bring Minnesotans without shelter in from the cold.

I couldn’t be prouder of the incredible impact this initiative has made across the state. http://www.startribune.com/with-boost-from-the-state-hundreds-of-emergency-shelter-beds-open-for-homeless-minnesotans/567556292/ …",[],['http://www.startribune.com/with-boost-from-the-state-hundreds-of-emergency-shelter-beds-open-for-homeless-minnesotans/567556292/'],[],6,6,72,[],[],https://twitter.com/GovTimWalz/status/1224826999715385345,False,,0,,,,,,,"[{'user_id': '1064603540956565504', 'username': 'GovTimWalz'}]",,,,
1224372776225648642,1224372776225648642,1580748192000,2020-02-03,11:43:12,EDT,1064603540956565504,govtimwalz,Governor Tim Walz,,"The only way we can provide relief to Minnesotans struggling to afford their insulin is to call upon the pharmaceutical companies who created this crisis to help fund the solution.

It's time to move this commonsense solution forward. #insulin4all #mnleg http://www.startribune.com/cost-of-insulin-shouldn-t-be-cause-for-death/567476162/ …",[],['http://www.startribune.com/cost-of-insulin-shouldn-t-be-cause-for-death/567476162/'],[],7,17,78,"['#insulin4all', '#mnleg']",[],https://twitter.com/GovTimWalz/status/1224372776225648642,False,,0,,,,,,,"[{'user_id': '1064603540956565504', 'username': 'GovTimWalz'}]",,,,
1224168383878438917,1224168383878438917,1580699461000,2020-02-02,22:11:01,EDT,1064603540956565504,govtimwalz,Governor Tim Walz,,Congratulations to the @Chiefs and @PatrickMahomes on your SuperBowl win! What an incredible game. #SuperBowlLIV pic.twitter.com/BalGe5QMau,"['chiefs', 'patrickmahomes']",[],['https://pbs.twimg.com/media/EP0epzdWoAAhb7G.jpg'],2,18,407,['#superbowlliv'],[],https://twitter.com/GovTimWalz/status/1224168383878438917,False,,0,,,,,,,"[{'user_id': '1064603540956565504', 'username': 'GovTimWalz'}, {'user_id': '33583496', 'username': 'Chiefs'}, {'user_id': '353178677', 'username': 'PatrickMahomes'}]",,,,
1224125800380796930,1224125800380796930,1580689308000,2020-02-02,19:21:48,EDT,1064603540956565504,govtimwalz,Governor Tim Walz,,"Love seeing Winona, MN featured on a SuperBowl ad! Great place to visit, great place to live.

#WelcomeToWinona #SuperBowlLIV https://twitter.com/squarespace/status/1224108800292065281 …",[],['https://twitter.com/squarespace/status/1224108800292065281'],[],13,68,620,"['#welcometowinona', '#superbowlliv']",[],https://twitter.com/GovTimWalz/status/1224125800380796930,False,https://twitter.com/squarespace/status/1224108800292065281,0,,,,,,,"[{'user_id': '1064603540956565504', 'username': 'GovTimWalz'}]",,,,
1223642594959331329,1223642594959331329,1580574103000,2020-02-01,11:21:43,EDT,1064603540956565504,govtimwalz,Governor Tim Walz,,Beautiful Minnesota sunrise this morning. pic.twitter.com/kBorx9JYFg,[],[],['https://pbs.twimg.com/media/EPtAcnvWsAA-fht.jpg'],5,2,123,[],[],https://twitter.com/GovTimWalz/status/1223642594959331329,False,,0,,,,,,,"[{'user_id': '1064603540956565504', 'username': 'GovTimWalz'}]",,,,
1223315818697699329,1223315818697699329,1580496193000,2020-01-31,13:43:13,EDT,1064603540956565504,govtimwalz,Governor Tim Walz,,"MN's economy is strong because of our innovative spirit.

Thank you to the employees at @Medtronic for welcoming me yesterday. I'm committed to working with companies like Medtronic – who are the backbone of our region’s economy – to build #OneMinnesota together. pic.twitter.com/KMv5CS6ui7",['medtronic'],[],['https://pbs.twimg.com/media/EPoXQB-WsAcBu35.jpg'],6,4,30,['#oneminnesota'],[],https://twitter.com/GovTimWalz/status/1223315818697699329,False,,0,,,,,,,"[{'user_id': '1064603540956565504', 'username': 'GovTimWalz'}, {'user_id': '52846066', 'username': 'Medtronic'}]",,,,
1223031808658493441,1223031799808516097,1580428480000,2020-01-30,18:54:40,EDT,1064603540956565504,govtimwalz,Governor Tim Walz,,"Currently, there is a low immediate health risk for the public in the U.S.  We recommend Minnesotans take the same precautions recommended for avoiding cold and flu. My office remains in close contact with @mnhealth to monitor the situation.",['mnhealth'],[],[],0,5,31,[],[],https://twitter.com/GovTimWalz/status/1223031808658493441,False,,0,,,,,,,"[{'user_id': '1064603540956565504', 'username': 'GovTimWalz'}, {'user_id': '25149628', 'username': 'mnhealth'}]",,,,
1223031799808516097,1223031799808516097,1580428478000,2020-01-30,18:54:38,EDT,1064603540956565504,govtimwalz,Governor Tim Walz,,"Today I received a briefing on coronavirus with @mnhealth. With the rising number of cases in China and other countries, it’s a stressful time for all of us, but particularly those who have family and friends in China where most cases have been reported.",['mnhealth'],[],[],4,9,36,[],[],https://twitter.com/GovTimWalz/status/1223031799808516097,False,,0,,,,,,,"[{'user_id': '1064603540956565504', 'username': 'GovTimWalz'}, {'user_id': '25149628', 'username': 'mnhealth'}]",,,,
1222987405491408896,1222987266567680012,1580417894000,2020-01-30,15:58:14,EDT,1064603540956565504,govtimwalz,Governor Tim Walz,,"This is Jett. He has type 1 diabetes. He told us that he doesn’t want to become Alec or Jesse, two Minnesotans who died from rationing insulin.

That’s why today we introduced commonsense legislation to make insulin affordable for all Minnesotans. #insulin4all #mnleg",[],[],[],3,10,79,"['#insulin4all', '#mnleg']",[],https://twitter.com/GovTimWalz/status/1222987405491408896,False,,0,,,,,,,"[{'user_id': '1064603540956565504', 'username': 'GovTimWalz'}]",,,,
1222987266567680012,1222987266567680012,1580417861000,2020-01-30,15:57:41,EDT,1064603540956565504,govtimwalz,Governor Tim Walz,,"“I’m nine years old. I like Legos, Minecraft, Star Wars, Pokémon, and reading. I’ve had diabetes for almost three years. I am worried about what will happen to me when I become an adult and need to pay for my own insulin, because I know it’s so expensive.”

#insulin4all #mnleg pic.twitter.com/iZArstgBz3",[],[],[],11,79,299,"['#insulin4all', '#mnleg']",[],https://twitter.com/GovTimWalz/status/1222987266567680012,False,,1,,,,,,,"[{'user_id': '1064603540956565504', 'username': 'GovTimWalz'}]",,,,
